Id,Sentence
1,If the teacher once entered in to the class she should be well preaperd of what she is going to explain.
2,So I think we can not live if old people could not find siences and tecnologies and they did not developped.
3,New and new technology has been introduced to the society.
4,For not use car.
5,Here was no promise of morning except that we looked up through the trees we saw how low the forest had swung.
6,"Students can improve themselves by thinking on a subject that they learn the major ideas, they will become more creative and more observer and that characteristics obviosly help them during their life time."
7,"then, it gets spread area."
8,One possible outcome is that an environmentally-induced reduction in motorization levels in the richer countries will outweigh any rise in motorization levels in the poorer countries.
9,Goverment should check of the information that advertisment give to people.
10,Thus even today sex is considered as the least important topic in many parts of India.
11,i was offered a variety af subjects.
12,"Every person needs to know a bit about math, sciences, arts, literature and history in order to stand out in society."
13,"If they change them, the story will collape and be incorrect information."
14,"However, now many car companies struggle to develop an eco-car, such as Prius of Toyota."
15,"However, I do not agree with the statement by the following reasons."
16,"image you salf you are wark in factory just to do one thing like pot taire on car if they fire you you will destroy , becouse u dont know more than pot taire in car ."
17,One example can be given from the Computer Sciences where a lot of conceptual understanding is required rather than just learning the facts of how to code a software program such as learning the semantical fundementals of a programming language.
18,"While the travel company will most likely show them some interesting sites in order for their customers to advertise for their company to their family and friends, it is highly unlikely, that the company will tell about the sites that were not included in the tour -- for example due to entrance fees that would make the total package price overly expensive."
19,Disadvantage is parking their car is very difficult.
20,"They draw the consumers, like me, to purchase this great product with all these amazing ingredients and all that but actually they just sometimes make something up just to increase their sales."
21,"This is an easy way of life, because they make only the ""secure"" things."
22,"I want to talk about nocive or bad products like alcohol, hair spray and cigarrets."
23,For example they can play football whenever they want but the olders can not.
24,if the quality of the product is good and it is worth using customer will definetly buy it.
25,This isnt very helpfull cause the owner needs to spend more money on transport and goods for the workers.
26,Bigger farming are use more chemical product and substance to feed fish .
27,"Whereas, a community for the old and underprivleged would want help, aid and assistence from the youth."
28,If our scintist may not take the risk then how we can develope the new things and how we can make our life very comfartable and enjoyful.
29,"For example, if people wants to go traveling by plane, which will be definitely a popular transportation in the future, they have to drive a car or take a taxi or a bus to the airport."
30,"Forexample, My cousin is 12years old."
31,Finally student become more knowladgable and confident about knowladge.
32,"It figures Diana Krall wearing a Rolex watch and has a text that suggests that if the reader wants to belong to the restricted club, not necessarily of Rolex watch wearers, but of highly talented, sophisticated and competent artists, he or she should also have a Rolex."
33,"When we started evaluating on those to drop and those not to, I had dropped about a lot and now I can concetrate much better with the little I offer."
34,"if it does, you will only get some misundrestood idea about that acticle but not the original one."
35,"Secondly, chimp can also present the capability for grammer which means it can demonstrate the ability to combine words and be able to use grammatical constructions."
36,"Nevertheless, this city is having a big change."
37,"I think to learn facts is only an evidence if the students can work hard and if they are able to keep every detailled information as tought, but it's definitly not an evidence for their intelligence."
38,"Unforturntly, almost older people can not use internet, in spite of benefit of internet."
39,Facts can learn through many books.
40,"So, if i have alot of information about this subject , i will taulk too much with knowledge but if i have general information for this subject , i will talk about this subjec with my limited knowlege and this case may be make me shame like when my brother asked me about some thing but i have not alot of information about this thing."
41,becuse if i see some one did somthing to may safe me time and engy and it wok's i will do it .
42,"But when i finished medical school i was only able to specialize in one field because you can never master all what you have studied in medical school, which makes sense in a way or else there would be no specialities in medicine."
43,Maybe some of them just couldnt graduate from a single academic course but this is because he is not that type of human.
44,"He/she is simply left with no time to cope with mundane things, leave alone the community he/she lives in!"
45,There are several reason.
46,According to the reading the dinosaur is not an endotherm.
47,The government should think about the whole nature.
48,However instead of going for the class and having a good idea of what psycology is and some theories explaied concepts of it I rather memorized all of them.
49,This will give him the oportunity to find a good job related to his familiar abilities.
50,They will not be able to compete with other similar brands and the product will fizzle out or die.
51,People are now opening their eyes to the scenario when we would run out of fuel.
52,"Also the work of the media, television, magazines, and every stuff made for publicity affects the emotions of many people around the world, encouraging them to buy and buy anything they can."
53,but through high fuel efficieny point lecture cast doubt on the reading passage.
54,For me it was great because I need to talk on the phone locally and nationally for long periods of time.
55,"Since most urban areas are occupied with cars, they are all facing up with an irresistible problem of air and noise pollution."
56,But experts believe that it was a result of erosion that happened when Egypt's weather condition was
57,"It is true that consumers preffer to buy a product that has a lower price, but when international companies that has already the certification begins to send its market , people will preffer to consume theirs because the difference between prices is probbably not going to affect them to much."
58,4:they have a big chance to prepare for their future life
59,As the human settements increase and agriculture also increases and also the use of chemical pesticides.
60,One person if don't have good health that means so many things they could lost.
61,Many studies over the last 50 years have shown that people who have fluoride in their drinking water are considerably have less cavities than people who have not drinking nonfluoridated water.
62,They only care if the effects are good and popular among the crowds.
63,"That is why calculated risks, as one could call them, are the predecessors of big success, because they get people's attention by giving people new options."
64,It was more fun to explore somewhere new outside the places we knew well.
65,maybe not giving the exsact same response (because every thing in nature changes) but some thing prox.
66,I strongly desagree with the statement proposed and defenitely don`t want to believe that young people don`t spend time helping the community they live in.
67,"Likewise, The theory generating from the concept of memory is also not the appropriate way due to limited memory."
68,in organisations when the CEO or the MD makes a decision about the persons that can be mentored to take up the leadership position in the comming time after the current leadership devolves power the are given experience in all the departments of the company .a person may be a engineer by qualification but when being developed to take up the top job he is made to go through posting in all the departments so that he can have proper knowledge of the workings of all he departments .
69,because they spent time unmeaningful subjects.
70,"I was very fast, my best time was 55 seconds in 400 hundred meters is a good time in or country."
71,And young people spend time more ther lifestile.
72,"Conclusively, I think other transportations are more convenient than cars and there should be fewer cars and the streets will be no traffic jam and less air pollution, it's my opinion."
73,But I want to be selfish when I travel.
74,"He said in other words that the more flouride may create damage in human body, specifically the bone."
75,When these people create their new ideas others often look very strange on them.
76,If in this society who will not to do study they never concept there opportunity or can't understand any ideas so most of the important that in this situation and I also very interestion and also prefer that for the study material.
77,This is a universal truth.
78,You will learn to socialize with people.
79,We have to know this problem it's serious but almost people doens't know about this.
80,And the evidence of it is the complicate water-control system.
81,"No ohter transportation concept has been as successful as the car, not only because the goog street and highway system throughout the United States and Europe, but only because off the fact, that people love their cars."
82,It seems really good apatize.
83,This is most clearly shown in the field of economics.
84,"If they prefer to choose cars than motor bike, that means there will be many cars."
85,They don't have a big meat like on TV.
86,And it may increase more speeders.
87,"Obviously the doctor participate in the trial of these medications and they work for months and years to standarize the dose, the effects on the ailment , its side effects, physical and psychological dependance, and more over its toxic effects on the living being."
88,Students can focus on only a few subjects they are intwerested in and they will become an experts in those areas.
89,That's why he is a legend in these days and people repect him.
90,"Suth as, culers and people"
91,"But in other waythismakes other way country need to pay extra money to make, repair the roads What they did is reduce the amount of gas consumers, high the gas tax, and low the income tax because they thought, only rise the gas tax is unfair."
92,"Second, it is truffce that"
93,"Today, MBA students with a background in engineering are in high demand."
94,"For example, video materials will help instructing to students."
95,In the case of young people the best way is studying as hard as possible to get better grades so in the future they will have better chance to find better jobs.
96,I think these researches are very noble and hopefully they will provide a better energy source.
97,So the school try learning the students a bit in every science exist.
98,"for example, in math club, teachers usually teach us how to solve a math problem using vary ways."
99,I think they have to get skill on it.
100,Specializing in one particular subject does not suit our life in this era which is characterized by diversity and innovation
